{
  "schema_version": 2,
  "id": "mtplx-2.11.2",
  "runtime_type": "mtplx",
  "version": "2.11.2",
  "repository": "https://github.com/youssofal/mtplx",
  "license": "Apache-2.0",
  "python": "3.12",
  "platform": "macos-arm64",
  "lock": "manifests/locks/mtplx-2.11.2-macos-arm64-py312.txt",
  "lock_sha256": "88c33df0e5a6171aa503713d8b1af04b0801c39560cb2db3f5079f64a22157b0",
  "packages": [
    {
      "name": "annotated-doc",
      "version": "0.0.5"
    },
    {
      "name": "annotated-types",
      "version": "0.8.0"
    },
    {
      "name": "anyio",
      "version": "4.15.1"
    },
    {
      "name": "certifi",
      "version": "2026.7.22"
    },
    {
      "name": "click",
      "version": "8.5.0"
    },
    {
      "name": "fastapi",
      "version": "0.141.1"
    },
    {
      "name": "filelock",
      "version": "3.32.5"
    },
    {
      "name": "fsspec",
      "version": "2026.7.0"
    },
    {
      "name": "h11",
      "version": "0.16.0"
    },
    {
      "name": "hf-xet",
      "version": "1.6.0"
    },
    {
      "name": "httpcore",
      "version": "1.0.9"
    },
    {
      "name": "httpx",
      "version": "0.28.1"
    },
    {
      "name": "huggingface-hub",
      "version": "1.30.0"
    },
    {
      "name": "idna",
      "version": "3.19"
    },
    {
      "name": "jinja2",
      "version": "3.1.6"
    },
    {
      "name": "llguidance",
      "version": "1.8.0"
    },
    {
      "name": "markdown-it-py",
      "version": "4.2.0"
    },
    {
      "name": "markupsafe",
      "version": "3.0.3"
    },
    {
      "name": "mdurl",
      "version": "0.1.2"
    },
    {
      "name": "mlx",
      "version": "0.32.2"
    },
    {
      "name": "mlx-lm",
      "version": "0.31.3"
    },
    {
      "name": "mlx-metal",
      "version": "0.32.2"
    },
    {
      "name": "mtplx",
      "version": "2.11.2"
    },
    {
      "name": "nanobind",
      "version": "3.0.1"
    },
    {
      "name": "numpy",
      "version": "2.5.3"
    },
    {
      "name": "packaging",
      "version": "26.3"
    },
    {
      "name": "pillow",
      "version": "12.3.0"
    },
    {
      "name": "protobuf",
      "version": "7.36.1"
    },
    {
      "name": "pydantic",
      "version": "2.13.5"
    },
    {
      "name": "pydantic-core",
      "version": "2.46.5"
    },
    {
      "name": "pygments",
      "version": "2.21.0"
    },
    {
      "name": "pyyaml",
      "version": "6.0.3"
    },
    {
      "name": "regex",
      "version": "2026.9.3"
    },
    {
      "name": "rich",
      "version": "15.0.0"
    },
    {
      "name": "safetensors",
      "version": "0.8.0"
    },
    {
      "name": "sentencepiece",
      "version": "0.2.2"
    },
    {
      "name": "shellingham",
      "version": "1.5.4"
    },
    {
      "name": "starlette",
      "version": "1.6.0"
    },
    {
      "name": "tokenizers",
      "version": "0.22.2"
    },
    {
      "name": "tqdm",
      "version": "4.70.0"
    },
    {
      "name": "transformers",
      "version": "5.14.1"
    },
    {
      "name": "typer",
      "version": "0.27.2"
    },
    {
      "name": "typing-extensions",
      "version": "4.16.0"
    },
    {
      "name": "typing-inspection",
      "version": "0.4.4"
    },
    {
      "name": "uvicorn",
      "version": "0.52.4"
    }
  ],
  "capabilities": {
    "serve": true,
    "api_bench": true,
    "local_bench": false
  }
}
